{
  "schemaVersion": 1,
  "id": "world-editor.cursor-type-references",
  "name": "Inspect cursor type references",
  "description": "Finds the reflected ClientPlayerInput type and its captured live-table and static code references. Run capture.runtime first. This reads evidence and calls no game functions.",
  "capabilities": [],
  "execution": {
    "kind": "python",
    "script": "game_inspection/analyze/find_runtime_type.py",
    "args": [
      "{diagnosticExports}/capture.runtime",
      "keen::ecs::ClientPlayerInput",
      "--out", "{exports}/cursor-type-references.json"
    ]
  }
}
