{
  "schemaVersion": 1,
  "id": "capture.runtime",
  "name": "Capture executable and live runtime",
  "description": "Reads executable reflection, functions and live component registries. Saves reflection.json and components.json for subsequent captures. Requires Python discovery dependencies.",
  "capabilities": [],
  "execution": {
    "kind": "python",
    "script": "game_inspection/capture/discover_runtime_build.py",
    "args": ["{gameExe}", "--functions", "--pid", "{pid}", "--out", "{exports}"]
  }
}
