{
  "schemaVersion": 1,
  "id": "verify.inventory-decrement",
  "name": "Verify original inventory decrement",
  "description": "Emulates original inventory decrement instructions in Unicorn with isolated dependency stubs. Saves inventory-decrement.json. Requires Python discovery dependencies.",
  "capabilities": [],
  "execution": {
    "kind": "python",
    "script": "game_inspection/checks/verify_inventory_decrement.py",
    "args": ["{gameExe}", "--out", "{exports}/inventory-decrement.json"]
  }
}
