{
  "schemaVersion": 1,
  "id": "inspect.system-dependencies",
  "name": "Inspect ECS system dependencies",
  "description": "Resolves captured ECS dependency layouts with the production Rust resolver. Run capture.runtime first in this game process.",
  "capabilities": [],
  "execution": {
    "kind": "rust",
    "action": "inspect-system-dependencies"
  }
}
