{
  "schemaVersion": 1,
  "id": "world-editor.typed-inputs",
  "name": "World Editor: typed input observation",
  "description": "Observes reflected input fields, registrations and consumed versions across world sessions. Reads only.",
  "capabilities": ["runtime", "operations"],
  "execution": {
    "kind": "lua",
    "modId": "world-editor",
    "script": "world-editor/observe_typed_inputs.lua"
  }
}
