{
  "schemaVersion": 1,
  "id": "inspect.inventory-transactions",
  "name": "Inspect original inventory transactions",
  "description": "Inspects named inventory systems and original transaction instructions in the executable. Saves inventory-transactions.json. Requires Python discovery dependencies.",
  "capabilities": [],
  "execution": {
    "kind": "python",
    "script": "game_inspection/inspect/inspect_inventory_transactions.py",
    "args": ["{gameExe}", "--out", "{exports}/inventory-transactions.json"]
  }
}
