{
  "schemaVersion": 1,
  "id": "capture.factory-state",
  "name": "Capture factory and linked inventory state",
  "description": "Reads factories and linked inventories using reflection and registries from capture.runtime. Run capture.runtime first in the same game process. Requires Python discovery dependencies.",
  "capabilities": [],
  "execution": {
    "kind": "python",
    "script": "game_inspection/capture/capture_factory_state.py",
    "args": [
      "--exe", "{gameExe}",
      "--pid", "{pid}",
      "--reflection", "{diagnosticExports}/capture.runtime/reflection.json",
      "--components", "{diagnosticExports}/capture.runtime/components.json",
      "--out", "{exports}/factory-state.json"
    ]
  }
}
