{
  "schemaVersion": 1,
  "id": "world-editor.registered-impact-ab",
  "name": "World Editor: registered Impact A/B",
  "description": "Calls the admitted IsSameEntity operation with four A/B cases and checks rejection of unadmitted operations. No world writes.",
  "capabilities": ["runtime", "operations"],
  "execution": {
    "kind": "lua",
    "modId": "world-editor",
    "script": "world-editor/check_registered_impact.lua"
  }
}
